Time, Difficulty, EventType, Latency, Score, TargetVesselTypescore, TargetIsPortStarboardscore, TargetIsBowBeamSternscore, TargetRangescore, TargetBearingscore, TargetAnglescore, TargetBearingDriftscore, TargetCPARangescore, TargetCPAIsPortStarboardscore, TargetCPAIsBowBeamSternscore, TargetCPATimescore, RuleTypescore, StandOnGiveWayscore, Actionscore, Degreesscore, Speedscore, TargetVesselTypechosen, TargetVesselTypecorrect, TargetIsPortStarboardchosen, TargetIsPortStarboardcorrect, TargetIsBowBeamSternchosen, TargetIsBowBeamSterncorrect, TargetRangechosen, TargetRangecorrect, TargetBearingchosen, TargetBearingcorrect, TargetAnglechosen, TargetAnglecorrect, TargetBearingDriftchosen, TargetBearingDriftcorrect, TargetCPARangechosen, TargetCPARangecorrect, TargetCPAIsPortStarboardchosen, TargetCPAIsPortStarboardcorrect, TargetCPAIsBowBeamSternchosen, TargetCPAIsBowBeamSterncorrect, TargetCPATimechosen, TargetCPATimecorrect, RuleTypechosen, RuleTypecorrect, StandOnGiveWaychosen, StandOnGiveWaycorrect, Actionchosen, Actioncorrect, Degreeschosen, Degreescorrect, Speedchosen, Speedcorrect, 
063.2, 0.22, Answer, 000.0, 34.7, 2, 2, 2, 0, 0, 0, 0, 0, 5, 0, 1.7, 0, 2, 19, 1, 0, TugWithTow, TugWithTow, Port, Port, Bow, Bow, 8100, 7019, 347, 359, 180, 0, has slight left, is CBDR, 1600, 0, Port, Port, Bow, Beam, 6, 8, Overtaking, Head On, Giveway, Giveway, turn to starboard, turn to starboard, 90 deg, 90 deg, hold speed, hold speed, , 
122.5, 0.24, Answer, 000.0, 44.4, 2, 0, 2, 1.7, 0, 0, 0, 0, 0, 0, 1.7, 15, 2, 19, 1, 0, Merchant, Merchant, Port, Stbd, Bow, Bow, 8600, 7672, 56, 25, 29, 325, has strong left, is CBDR, 5000, 0, Port, Stbd, Bow, Quarter, 6, 8, Crossing, Crossing, Giveway, Giveway, turn to starboard, turn to starboard, 20 deg, 20 deg, hold speed, hold speed, , 
136.3, 0.26, Answer, 000.0, 41, 2, 0, 2, 0, 0, 0, 0, 0, 0, 0, 0, 15, 2, 19, 1, 0, Merchant, Merchant, Port, Stbd, Bow, Bow, 8600, 7423, 56, 31, 29, 315, has strong left, is CBDR, 5000, 0, Port, Stbd, Bow, Quarter, 6, 9, Crossing, Crossing, Giveway, Giveway, turn to starboard, turn to starboard, 30 deg, 30 deg, hold speed, hold speed, , 
155.2, 0.28, Answer, 000.0, 41, 2, 0, 2, 0, 0, 0, 0, 0, 0, 0, 0, 15, 2, 19, 1, 0, Merchant, Merchant, Port, Stbd, Bow, Bow, 8600, 7260, 56, 32, 29, 314, has strong left, is CBDR, 5000, 0, Port, Stbd, Bow, Quarter, 6, 9, Crossing, Crossing, Giveway, Giveway, turn to starboard, turn to starboard, 30 deg, 30 deg, hold speed, hold speed, , 
232.5, 0.31, Answer, 000.0, 58.7, 2, 2, 2, 1.7, 3, 20, 18, 2, 5, 0, 2, 0, 0, 0, 1, 0, TugWithTow, TugWithTow, Stbd, Stbd, Bow, Bow, 3700, 3148, 0, 0, 180, 179, is CBDR, is CBDR, 100, 27, Stbd, Stbd, Quarter, Beam, 7, 7, Crossing, Overtaking, Stand on, Giveway, hold course and speed, turn to starboard, 0 deg, 0 deg, hold speed, hold speed, , 
242.4, 0.34, Answer, 000.0, 59, 2, 2, 2, 2, 3, 20, 18, 2, 5, 0, 2, 0, 0, 0, 1, 0, TugWithTow, TugWithTow, Stbd, Stbd, Bow, Bow, 3700, 3212, 0, 0, 180, 179, is CBDR, is CBDR, 100, 10, Stbd, Stbd, Quarter, Beam, 7, 8, Crossing, Overtaking, Stand on, Giveway, hold course and speed, turn to starboard, 0 deg, 0 deg, hold speed, hold speed, , 
327.7, 0.34, Answer, 000.0, 5, 0, 0, 2, 0, 0, 0, 0, 0, 0, 0, 2, 0, 0, 0, 1, 0, Yavuz_32, HOS Brigadoon_54, Stbd, Port, Bow, Bow, 3800, 7324, 329, 358, 94, 1, has strong left, is CBDR, 5000, 0, Port, Stbd, Bow, Beam, 6, 7, Crossing, Head On, Stand on, Giveway, hold course and speed, turn to starboard, 90 deg, 90 deg, hold speed, hold speed, , 
400.5, 0.37, Answer, 000.0, 62, 0, 0, 2, 0, 3, 0, 18, 0, 0, 0, 2, 15, 2, 19, 1, 0, Pusher Pup_92, Pusher Pup_110, Port, Stbd, Bow, Bow, 2600, 6626, 358, 0, 180, 358, is CBDR, is CBDR, 5000, 0, Port, Stbd, Bow, Beam, 7, 7, Head On, Head On, Giveway, Giveway, turn to starboard, turn to starboard, 0 deg, 0 deg, hold speed, hold speed, , 
