Time, Difficulty, EventType, Latency, Score, TargetVesselTypescore, TargetIsPortStarboardscore, TargetIsBowBeamSternscore, TargetRangescore, TargetBearingscore, TargetAnglescore, TargetBearingDriftscore, TargetCPARangescore, TargetCPAIsPortStarboardscore, TargetCPAIsBowBeamSternscore, TargetCPATimescore, RuleTypescore, StandOnGiveWayscore, Actionscore, Degreesscore, Speedscore, TargetVesselTypechosen, TargetVesselTypecorrect, TargetIsPortStarboardchosen, TargetIsPortStarboardcorrect, TargetIsBowBeamSternchosen, TargetIsBowBeamSterncorrect, TargetRangechosen, TargetRangecorrect, TargetBearingchosen, TargetBearingcorrect, TargetAnglechosen, TargetAnglecorrect, TargetBearingDriftchosen, TargetBearingDriftcorrect, TargetCPARangechosen, TargetCPARangecorrect, TargetCPAIsPortStarboardchosen, TargetCPAIsPortStarboardcorrect, TargetCPAIsBowBeamSternchosen, TargetCPAIsBowBeamSterncorrect, TargetCPATimechosen, TargetCPATimecorrect, RuleTypechosen, RuleTypecorrect, StandOnGiveWaychosen, StandOnGiveWaycorrect, Actionchosen, Actioncorrect, Degreeschosen, Degreescorrect, Speedchosen, Speedcorrect, 
167.1, 0.43, Answer, 000.0, 60.25, 0, 0, 2, 1.7, 2.55, 17, 0, 0, 0, 0, 0, 15, 2, 19, 1, 0, Sirius Star_11, MV Serius Star_31, Stbd, Port, Bow, Bow, 5100, 4515, 8, 359, 10, 0, has slight left, is CBDR, 500, 0, Stbd, Port, Bow, Beam, 12, 4, Head On, Head On, Giveway, Giveway, turn to starboard, turn to starboard, 90 deg, 90 deg, hold speed, hold speed, , 
313.2, 0.46, Answer, 000.0, 60, 2, 2, 0, 2, 3, 20, 0, 2, 5, 0, 2, 0, 2, 19, 1, 0, Tractor Tug 200_63, Tractor Tug 200_63, Stbd, Stbd, Bow, Stern, 1500, 1306, 179, 179, 0, 358, has slight left, is CBDR, 100, 22, Stbd, Stbd, Bow, Beam, 4, 4, Crossing, Overtaking, Stand on, Stand on, hold course and speed, hold course and speed, 90 deg, 90 deg, hold speed, hold speed, , 
448.8, 0.47, Answer, 000.0, 29, 0, 2, 2, 0, 3, 0, 0, 2, 0, 0, 2, 15, 2, 0, 1, 0, Low Life_74, HOS Brigadoon_97, Stbd, Stbd, Bow, Bow, 1600, 4400, 5, 0, 25, 358, has slight left, is CBDR, 200, 1, Stbd, Port, Bow, Beam, 3, 4, Head On, Head On, Giveway, Giveway, turn to port, turn to starboard, 0 deg, 0 deg, hold speed, hold speed, , 
570.0, 0.50, Answer, 000.0, 55, 2, 2, 0, 2, 3, 0, 0, 2, 5, 0, 2, 15, 2, 19, 1, 0, BoomBoom_131, BoomBoom_131, Port, Port, Quarter, Stern, 1300, 1142, 180, 180, 180, 0, has slight left, is CBDR, 200, 18, Port, Port, Quarter, Beam, 5, 4, Overtaking, Overtaking, Stand on, Stand on, hold course and speed, hold course and speed, 90 deg, 90 deg, hold speed, hold speed, , 
740.9, 0.52, Answer, 000.0, 28, 0, 2, 2, 0, 0, 0, 0, 2, 0, 0, 0, 0, 2, 19, 1, 0, CMA CGM Norsk_144, Smit Houston_167, Stbd, Stbd, Bow, Bow, 1600, 3186, 20, 0, 31, 359, has slight left, is CBDR, 100, 0, Port, Stbd, Bow, Beam, 6, 3, Crossing, Head On, Giveway, Giveway, turn to starboard, turn to starboard, 0 deg, 0 deg, hold speed, hold speed, , 
819.2, 0.54, Answer, 000.0, 40, 2, 2, 0, 2, 3, 0, 0, 2, 5, 0, 2, 0, 2, 19, 1, 0, Sirius Star_203, Sirius Star_203, Port, Port, Quarter, Stern, 1700, 1369, 180, 180, 180, 1, has slight left, is CBDR, 100, 64, Port, Port, Bow, Beam, 5, 5, Crossing, Overtaking, Stand on, Stand on, hold course and speed, hold course and speed, 90 deg, 90 deg, hold speed, hold speed, , 
940.4, 0.55, Answer, 000.0, 31, 0, 0, 2, 0, 0, 0, 0, 2, 5, 0, 0, 0, 2, 19, 1, 0, MV Serius Star_213, Sirius Star_241, Stbd, Port, Bow, Bow, 2200, 3851, 12, 358, 16, 1, has strong left, is CBDR, 100, 0, Stbd, Stbd, Bow, Beam, 12, 4, Crossing, Head On, Giveway, Giveway, turn to starboard, turn to starboard, 90 deg, 90 deg, hold speed, hold speed, , 
1061.2, 0.57, Answer, 000.0, 32, 2, 0, 2, 2, 0, 0, 0, 2, 0, 0, 2, 0, 2, 19, 1, 0, Akuna 4_279, Akuna 4_279, Port, Stbd, Bow, Bow, 2400, 2051, 180, 0, 0, 179, has slight left, is CBDR, 200, 1, Port, Stbd, Bow, Beam, 5, 4, Head On, Overtaking, Giveway, Giveway, turn to starboard, turn to starboard, 0 deg, 0 deg, hold speed, hold speed, , 
