Time, Difficulty, EventType, Latency, Score, TargetVesselTypescore, TargetIsPortStarboardscore, TargetIsBowBeamSternscore, TargetRangescore, TargetBearingscore, TargetAnglescore, TargetBearingDriftscore, TargetCPARangescore, TargetCPAIsPortStarboardscore, TargetCPAIsBowBeamSternscore, TargetCPATimescore, RuleTypescore, StandOnGiveWayscore, Actionscore, Degreesscore, Speedscore, TargetVesselTypechosen, TargetVesselTypecorrect, TargetIsPortStarboardchosen, TargetIsPortStarboardcorrect, TargetIsBowBeamSternchosen, TargetIsBowBeamSterncorrect, TargetRangechosen, TargetRangecorrect, TargetBearingchosen, TargetBearingcorrect, TargetAnglechosen, TargetAnglecorrect, TargetBearingDriftchosen, TargetBearingDriftcorrect, TargetCPARangechosen, TargetCPARangecorrect, TargetCPAIsPortStarboardchosen, TargetCPAIsPortStarboardcorrect, TargetCPAIsBowBeamSternchosen, TargetCPAIsBowBeamSterncorrect, TargetCPATimechosen, TargetCPATimecorrect, RuleTypechosen, RuleTypecorrect, StandOnGiveWaychosen, StandOnGiveWaycorrect, Actionchosen, Actioncorrect, Degreeschosen, Degreescorrect, Speedchosen, Speedcorrect, 
320.2, 0.41, Answer, 000.0, 20, 0, 0, 0, 0, 0, 17, 0, 0, 0, 0, 2, 0, 0, 0, 1, 0, Tractor Tug 50_9, MV Serius Star_31, Stbd, Port, Quarter, Bow, 3100, 1860, 173, 359, 10, 0, has strong left, is CBDR, 4600, 0, Stbd, Port, Quarter, Beam, 2, 2, Overtaking, Head On, Stand on, Giveway, hold course and speed, turn to starboard, 90 deg, 90 deg, hold speed, hold speed, , 
509.0, 0.41, Answer, 000.0, 2.7, 0, 0, 0, 0, 0, 0, 0, 0, 0, 0, 1.7, 0, 0, 0, 1, 0, APLB_43, Tractor Tug 200_63, Port, Stbd, Bow, Stern, 6400, 1115, 4, 179, 40, 358, has strong left, is CBDR, 5000, 23, Port, Stbd, Bow, Beam, 6, 4, Head On, Overtaking, Giveway, Stand on, turn to starboard, hold course and speed, 90 deg, 90 deg, hold speed, hold speed, , 
614.4, 0.43, Answer, 000.0, 29, 0, 2, 2, 0, 0, 17, 0, 0, 5, 0, 2, 0, 0, 0, 1, 0, CMA CGM Norsk_72, HOS Brigadoon_95, Port, Port, Bow, Bow, 3100, 5640, 178, 359, 10, 0, has strong left, is CBDR, 5000, 0, Port, Port, Bow, Beam, 6, 5, Overtaking, Head On, Stand on, Giveway, hold course and speed, turn to starboard, 90 deg, 90 deg, hold speed, hold speed, , 
779.1, 0.43, Answer, 000.0, 14.7, 0, 2, 0, 0, 0, 0, 0, 0, 5, 5, 1.7, 0, 0, 0, 1, 0, Sirius Star_102, HOS Brigadoon_127, Stbd, Stbd, Quarter, Bow, 6500, 3933, 182, 21, 23, 327, has strong left, is CBDR, 5000, 0, Stbd, Stbd, Quarter, Quarter, 6, 4, Overtaking, Crossing, Stand on, Giveway, hold course and speed, turn to starboard, 20 deg, 20 deg, hold speed, hold speed, , 
949.8, 0.46, Answer, 000.0, 52.25, 0, 2, 2, 2, 2.55, 0, 0, 0, 5, 0, 1.7, 15, 2, 19, 1, 0, Hook Vessels, HOS Brigadoon_159, Stbd, Stbd, Bow, Bow, 2100, 1866, 10, 0, 5, 179, has strong left, is CBDR, 5000, 13, Stbd, Stbd, Bow, Beam, 2, 4, Overtaking, Overtaking, Giveway, Giveway, turn to starboard, turn to starboard, 0 deg, 0 deg, hold speed, hold speed, , 
